{
  "slug": "copilot-add-play-only-one-episode",
  "kind": "branch",
  "branch": "copilot/add-play-only-one-episode",
  "pr": 131,
  "sha": "b3f19ab0b21397ee160fd5e72e42a749571a4779",
  "ciRunUrl": "https://github.com/percebus/hello-spec-kit/actions/runs/41204980948",
  "publishedAt": "2026-10-31T13:24:13.086Z"
}
