{
  "slug": "copilot-us-episode-collection-full-metadata",
  "kind": "branch",
  "branch": "copilot/us-episode-collection-full-metadata",
  "pr": 132,
  "sha": "12c49f88c4bd5b5418e2a8ed6b32bbc84c1c98e5",
  "ciRunUrl": "https://github.com/percebus/hello-spec-kit/actions/runs/41205451164",
  "publishedAt": "2026-10-31T13:30:10.878Z"
}
